[
  {
    "id": "faction-captors",
    "name": "the two figures",
    "type": "faction",
    "status_summary": "Have partially loosened the player character's restraints after a demonstration ",
    "first_seen_turn": "turn-007",
    "last_updated_turn": "turn-025",
    "active_relationship_count": 1
  },
  {
    "id": "faction-caribou-herds",
    "name": "Herds",
    "type": "faction",
    "status_summary": "Actively participating in council discussions on sustainable hunting practices, ",
    "first_seen_turn": "turn-189",
    "last_updated_turn": "turn-287",
    "active_relationship_count": 0
  },
  {
    "id": "faction-children",
    "name": "the children and apprentices",
    "type": "faction",
    "status_summary": "Listening to the player's proposal to establish a daily storytelling tradition t",
    "first_seen_turn": "turn-159",
    "last_updated_turn": "turn-339",
    "active_relationship_count": 0
  },
  {
    "id": "faction-clan",
    "name": "the clan",
    "type": "faction",
    "status_summary": "A member of the clan experiences physical relief and emotional comfort through t",
    "first_seen_turn": "turn-086",
    "last_updated_turn": "turn-097",
    "active_relationship_count": 0
  },
  {
    "id": "faction-council",
    "name": "Council",
    "type": "faction",
    "status_summary": "Finalizing winter preparations and formalizing new alliances. The council has ac",
    "first_seen_turn": "turn-309",
    "last_updated_turn": "turn-324",
    "active_relationship_count": 0
  },
  {
    "id": "faction-crafters",
    "name": "Crafters",
    "type": "faction",
    "status_summary": "Entity referenced in events (stub — auto-created from event data).",
    "first_seen_turn": "turn-294",
    "last_updated_turn": "turn-294",
    "active_relationship_count": 0
  },
  {
    "id": "faction-elders",
    "name": "Southern Elders",
    "type": "faction",
    "status_summary": "Observing the main tribe's methods and evaluating their effectiveness. They are ",
    "first_seen_turn": "turn-127",
    "last_updated_turn": "turn-314",
    "active_relationship_count": 0
  },
  {
    "id": "faction-five-warriors",
    "name": "Gorok's warriors",
    "type": "faction",
    "status_summary": "Maintaining a managed tension between raw force and patient strategy; Gorok ackn",
    "first_seen_turn": "turn-317",
    "last_updated_turn": "turn-342",
    "active_relationship_count": 0
  },
  {
    "id": "faction-former-captors",
    "name": "the former captors",
    "type": "faction",
    "status_summary": "Assisting the player in their release from captivity by untangling icy vines and",
    "first_seen_turn": "turn-029",
    "last_updated_turn": "turn-029",
    "active_relationship_count": 1
  },
  {
    "id": "faction-four-from-thorne",
    "name": "the four from Thorne",
    "type": "faction",
    "status_summary": "Departing for Thorne to recruit their people, having completed their integration",
    "first_seen_turn": "turn-323",
    "last_updated_turn": "turn-324",
    "active_relationship_count": 0
  },
  {
    "id": "faction-hunters",
    "name": "the hunters",
    "type": "faction",
    "status_summary": "Engaged in new responsibilities: changing hunting patterns, mapping migration pa",
    "first_seen_turn": "turn-037",
    "last_updated_turn": "turn-210",
    "active_relationship_count": 0
  },
  {
    "id": "faction-men",
    "name": "the men",
    "type": "faction",
    "status_summary": "Discussing defensive strategies, emphasizing the need for a water reserve, hidin",
    "first_seen_turn": "turn-077",
    "last_updated_turn": "turn-168",
    "active_relationship_count": 0
  },
  {
    "id": "faction-non-combatant",
    "name": "non combatant",
    "type": "faction",
    "status_summary": "Actively participating in the player's discussions about shaping the tribe's fut",
    "first_seen_turn": "turn-168",
    "last_updated_turn": "turn-341",
    "active_relationship_count": 0
  },
  {
    "id": "faction-other-tribes",
    "name": "the migrating tribes",
    "type": "faction",
    "status_summary": "The player is at a decision point regarding how to integrate Maelis of the Swift",
    "first_seen_turn": "turn-164",
    "last_updated_turn": "turn-332",
    "active_relationship_count": 0
  },
  {
    "id": "faction-raiders",
    "name": "Raiders",
    "type": "faction",
    "status_summary": "Imminent threat to the player's tribe, with the player actively preparing layere",
    "first_seen_turn": "turn-164",
    "last_updated_turn": "turn-173",
    "active_relationship_count": 0
  },
  {
    "id": "faction-refugees",
    "name": "refugees",
    "type": "faction",
    "status_summary": "Continuing to seek refuge and potential alliance with the player's tribe, while ",
    "first_seen_turn": "turn-164",
    "last_updated_turn": "turn-173",
    "active_relationship_count": 0
  },
  {
    "id": "faction-riverfolk",
    "name": "the Riverfolk",
    "type": "faction",
    "status_summary": "The Riverfolk have migrated south-east into the lands of the migrating tribes. M",
    "first_seen_turn": "turn-326",
    "last_updated_turn": "turn-332",
    "active_relationship_count": 0
  },
  {
    "id": "faction-shaman-and-anya",
    "name": "The Shaman and Anya",
    "type": "faction",
    "status_summary": "Elder Lyra, a member of the faction, steps forward to join the player, offering ",
    "first_seen_turn": "turn-301",
    "last_updated_turn": "turn-318",
    "active_relationship_count": 0
  },
  {
    "id": "faction-sickness",
    "name": "Sickness",
    "type": "faction",
    "status_summary": "The group is observing multiple fronts: the man's recovery, the southern tribes'",
    "first_seen_turn": "turn-287",
    "last_updated_turn": "turn-254",
    "active_relationship_count": 0
  },
  {
    "id": "faction-southern-shamans",
    "name": "Southern Shamans",
    "type": "faction",
    "status_summary": "Continuing their agricultural practices with the plague method, maintaining the ",
    "first_seen_turn": "turn-256",
    "last_updated_turn": "turn-341",
    "active_relationship_count": 0
  },
  {
    "id": "faction-southern-tribes",
    "name": "the southern tribes",
    "type": "faction",
    "status_summary": "Engaged in diplomatic discussions with the player about the responsibilities and",
    "first_seen_turn": "turn-210",
    "last_updated_turn": "turn-211",
    "active_relationship_count": 1
  },
  {
    "id": "faction-thieves",
    "name": "thieves",
    "type": "faction",
    "status_summary": "The player remains vigilant about the thieves' presence, as the tribe's new stab",
    "first_seen_turn": "turn-164",
    "last_updated_turn": "turn-173",
    "active_relationship_count": 0
  },
  {
    "id": "faction-thorne-people",
    "name": "Thorne People",
    "type": "faction",
    "status_summary": "Entity referenced in events (stub — auto-created from event data).",
    "first_seen_turn": "turn-332",
    "last_updated_turn": "turn-332",
    "active_relationship_count": 0
  },
  {
    "id": "faction-trackers",
    "name": "the trackers",
    "type": "faction",
    "status_summary": "Departing from the settlement to return to Thorne. They have accepted the bond w",
    "first_seen_turn": "turn-321",
    "last_updated_turn": "turn-324",
    "active_relationship_count": 0
  },
  {
    "id": "faction-travelers-strangers",
    "name": "travelers, strangers",
    "type": "faction",
    "status_summary": "Present at the longhouse, having arrived during the player's absence. They are p",
    "first_seen_turn": "turn-208",
    "last_updated_turn": "turn-331",
    "active_relationship_count": 0
  },
  {
    "id": "faction-tribe",
    "name": "your people",
    "type": "faction",
    "status_summary": "The faction is actively engaged in agricultural innovation, leadership training,",
    "first_seen_turn": "turn-093",
    "last_updated_turn": "turn-211",
    "active_relationship_count": 2
  },
  {
    "id": "faction-villagers",
    "name": "the villagers",
    "type": "faction",
    "status_summary": "Observing the player's interaction with the elder, their attention focused on th",
    "first_seen_turn": "turn-027",
    "last_updated_turn": "turn-043",
    "active_relationship_count": 1
  },
  {
    "id": "faction-women",
    "name": "the two maidens",
    "type": "faction",
    "status_summary": "Engaged in the rhythmic task of sorting herbs, preparing for the communal meal. ",
    "first_seen_turn": "turn-037",
    "last_updated_turn": "turn-043",
    "active_relationship_count": 0
  },
  {
    "id": "faction-younger-hunters",
    "name": "the younger hunters",
    "type": "faction",
    "status_summary": "Engaged in discussions with the player about changing hunting patterns, includin",
    "first_seen_turn": "turn-210",
    "last_updated_turn": "turn-211",
    "active_relationship_count": 0
  }
]
