[
  {
    "id": "loc-village-hall",
    "name": "village hall",
    "type": "location",
    "status_summary": "The player character is currently outside in the snow, recalling the worried fac",
    "first_seen_turn": "turn-001",
    "last_updated_turn": "turn-001",
    "active_relationship_count": 0
  },
  {
    "id": "loc-woods",
    "name": "snow-laden woods",
    "type": "location",
    "status_summary": "The player character is trapped inside the woods, pinned under a heavy net made ",
    "first_seen_turn": "turn-005",
    "last_updated_turn": "turn-005",
    "active_relationship_count": 0
  },
  {
    "id": "loc-camp-dwelling",
    "name": "camp or dwelling",
    "type": "location",
    "status_summary": "Visible ahead through thinning trees, emitting blue smoke and illuminated by a r",
    "first_seen_turn": "turn-013",
    "last_updated_turn": "turn-013",
    "active_relationship_count": 0
  },
  {
    "id": "loc-lean-tos",
    "name": "lean-tos",
    "type": "location",
    "status_summary": "Visible in the distance as the party approaches; smoke curls from it, and figure",
    "first_seen_turn": "turn-013",
    "last_updated_turn": "turn-013",
    "active_relationship_count": 0
  },
  {
    "id": "loc-encampment",
    "name": "encampment",
    "type": "location",
    "status_summary": "Illuminated by a flickering bonfire, with several human figures milling about. T",
    "first_seen_turn": "turn-015",
    "last_updated_turn": "turn-015",
    "active_relationship_count": 0
  }
]
